{"ausgestellt":"2025-12-30T10:00:00.000Z","format":"ledger-schluesselrollen/1","schluessel":[{"gueltig_ab":"2025-01-01T00:00:00Z","key_id":"vendor-test-001","pubkey":"959c448da9b35ea50abeca1f0a4cac57fc21c5b7ff7216d3e304bb5fc406d36c","rolle":"statements"},{"gueltig_ab":"2025-12-30T00:00:00.000Z","key_id":"vendor-statements-test-001","pubkey":"6122df9ab7a7a83ecd7540b4d66cef184bd08aba2cac06123337b8ab3e56c9c2","rolle":"statements"},{"gueltig_ab":"2025-12-30T00:00:00.000Z","key_id":"vendor-statements-test-002","pubkey":"0281ea7e6995a65287fb8b49092636b24cb645eb2a54bd1975a94f1597cc0ef5","rolle":"statements"},{"gueltig_ab":"2025-12-30T00:00:00.000Z","key_id":"vendor-update-manifest-test-001","pubkey":"8796764cebba035507d86bbf2ebf308738417b88f1bdab4f465484569c838f28","rolle":"update_manifest"},{"gueltig_ab":"2025-12-30T00:00:00.000Z","key_id":"vendor-log-rollen-1","pubkey":"73edaed42d761a1ab4fcc9be71a95b957542e89be13fa185e6ad1264ddc8b816","rolle":"protocol"}],"signatur":{"sig":"ab3ef1b5c40ca0bb81b468057efb78b84e06a6fbf4f259c5e4cc8ed1ac107af5c45380f910495e551b95bc659b094758d427be54d03f25b21e195ff7caedbe0b","wurzel_id":"testwurzel-1"},"version":1}
